{
  "id": "fb-sangguniang-bayan",
  "name": "Sangguniang Bayan ng Limay",
  "url": "https://www.facebook.com/profile.php?id=61556428786042",
  "description": "The municipal council: sessions, ordinances and resolutions.",
  "order": 2,
  "provenance": {
    "source_url": "https://www.facebook.com/profile.php?id=61556428786042",
    "source_name": "Sangguniang Bayan ng Limay",
    "retrieved_at": "2026-09-25",
    "verified": true,
    "verification_note": "Official Facebook page, named as it appears on Facebook."
  }
}
