{
  "order": 9,
  "provenance": {
    "verified": true,
    "source_url": "https://www.facebook.com/BataanPDRRMO",
    "source_name": "Provincial Disaster Risk Reduction and Management Office Bataan",
    "retrieved_at": "2026-09-29"
  },
  "id": "fb-bataan-pdrrmo",
  "url": "https://www.facebook.com/BataanPDRRMO",
  "name": "Provincial Disaster Risk Reduction and Management Office Bataan"
}
