{
  "id": "fb-1limay",
  "name": "Municipality of Limay (1Limay)",
  "url": "https://www.facebook.com/1Limay",
  "description": "The Municipal Government's main page: announcements, advisories and events.",
  "order": 1,
  "provenance": {
    "source_url": "https://www.facebook.com/1Limay",
    "source_name": "Municipality of Limay (1Limay)",
    "retrieved_at": "2026-09-25",
    "verified": true,
    "verification_note": "Official Facebook page, named as it appears on Facebook."
  }
}
